{
  "pact": "0.1",
  "type": "CallForBids",
  "id": "cfb_7d41a2",
  "buyer": "did:web:buyer.example:agents:procure-1",
  "task": {
    "spec_hash": "sha256:20304805d7f4698ccda0b61bd59a3d0db5fd348c01587c7e4e748dd5d7a7949c",
    "spec_uri": "https://buyer.example/specs/taskspec.json",
    "deadline": "2026-08-01T00:00:00Z"
  },
  "max_price": { "amount": "220.00", "currency": "USDC" },
  "verification": { "tier": "T0-reexec", "criteria_hash": "sha256:5446fc206aaee6a0c94199cee62df8ef5cb607d2ec043a8cb3f84d7a329fddd6" },
  "bid_deadline": "2026-07-25T12:00:00Z",
  "challenge": { "window_seconds": 3600, "max_dispute_seconds": 86400 },
  "signatures": [
    { "kid": "did:web:buyer.example:agents:procure-1#k1",
      "protected": "eyJhbGciOiJFUzI1NiJ9",
      "signature": "ILLUSTRATIVE-NOT-A-REAL-SIGNATURE" }
  ]
}
